tt0050083,"Hetty and Trevor work together to try to get Sam to be a tougher boss to her new employee, Freddie. Sas and car ghost Jessica continue to flirt. A recap and review of season two, episode 12 of the CBS series ‘Ghosts,’ “The Family Business.”",Ghosts Recap: Hashtag #GhostBoss,"Even under the best circumstances, it can be challenging to live and work with a relative. Now, imagine that relative is an uptight ghost from the 1800s who thinks she knows everything and whose busi… [+9189 chars]",http://www.vulture.com/article/ghosts-season-2-episode-12-recap-the-family-business.html
tt0050083,"Actress Frances McDormand says reading Miriam Toews' book, Women Talking, after it was published in 2019 helped her recognize, process and express the feelings she was experiencing at the beginning of the MeToo movement. | Entertainment",Frances McDormand: 'Women Talking' Helped Her Process Feelings About MeToo,"NEW YORK, Jan. 6 (UPI) — Three-time Oscar-winning actress Frances McDormand says reading Miriam Toews’ book, Women Talking, after it was published in 2019 helped her recognize, process and express th… [+5539 chars]",https://www.breitbart.com/entertainment/2023/01/06/frances-mcdormand-women-talking-helped-her-process-feelings-about-metoo/
tt0050083,"At the end of the twentieth century, the long predicted convergence of the media, computing and telecommunications into hypermedia is finally happening.[2] Once again, capitalism’s relentless drive…",“The Californian Ideology” by Richard Barbrook and Andy Cameron (1995),"https://en.wikipedia.org/wiki/The_Californian_Ideology
The Californian Ideology
by Richard Barbrook and Andy Cameron (1995)
Not to lie about the future is impossible and one can lie about it at wi… [+63096 chars]",https://bruces.medium.com/the-californian-ideology-by-richard-barbrook-and-andy-cameron-1995-c50014fcdbce
tt0050083,BEIRUT (AP) — Angry protesters in Syria’s rebel-held enclave rallied Friday against reconciliation attempts between Turkey and Syrian President Bashar...,Crowd attacks Syrian rebel figure over reconciliation push,BEIRUT (AP) Angry protesters in Syrias rebel-held enclave rallied Friday against reconciliation attempts between Turkey and Syrian President Bashar Assads government and scuffled with a local Syrian … [+2414 chars],https://www.thestar.com/news/world/middleeast/2023/01/13/crowd-attacks-syrian-rebel-figure-over-reconciliation-push.html
tt0050083,"Actor Danny Trejo learned about his family on the latest episode of FInding Your Roots, including that they were storeowners and landowners.",Danny Trejo is 'overwhelmed' by ancestry discovery that 'could've changed' his life,"Actor Danny Trejo grew up without a mother for most of his childhood, so he never knew much about her side of the family. And what he knew of his father's side of the family didn't give him much hope… [+3711 chars]",https://news.yahoo.com/danny-trejo-overwhelmed-ancestry-discovery-171230360.html
tt0050083,Hungry for new noise? Let us introduce you to 10 new artists who are primed to explode in the coming 12 months,10 new artists who're going to set 2023 on fire,"Searching for your new favourite artist? Here are 10 new acts poised to make a big noise in 2023, from post-punk to alt.trap-metal, old school rock 'n' roll to '90s-influenced hip-hop.
Sprints
Acro… [+6859 chars]",https://www.loudersound.com/features/10-new-artists-whore-going-to-set-2023-on-fire
tt0050083,Dozens of students from private schools in Sydney that are affiliated with the Opus Dei movement have spoken out about disturbing teachings within the schools.,"Students at private Sydney school taught masturbation is a disorder, pornography puts holes in your brain","Inside the suburban schools attended by members of the political elite, where sexual purity is prized.
At the end of each academic year, a graduating group of schoolgirls gathers in identical white … [+22567 chars]",https://www.abc.net.au/news/2023-01-30/inside-sydney-opus-dei-affiliated-private-schools/101777060
tt0050083,"From a stoic donkey to circus ""freaks"" battling the Nazis, here are best non-English language films of 2022.",The Best Non-English Language Films of 2022,"By Will DiGravio and Rob Hunter · Published on January 15th, 2023 
This article is part of our 2022 Rewind. Follow along as we explore the best and most interesting movies, shows, performances, and … [+12783 chars]",https://filmschoolrejects.com/best-non-english-language-films-2022/
tt0050083,Marvel Comics full April 2023 solicitations and cover previews,"Spider-Man, X-Men, Avengers, and all of Marvel's April 2023 comics and covers revealed","Marvel Comics' full April 2023 solicitations are now upon us. And with the bloom of spring comes a renewed focus by Marvel on the publisher's cosmic wing, along with many other comics from all around… [+102405 chars]",https://www.gamesradar.com/marvel-comics-april-2023-solicitations-and-covers/
tt0050083,"The film tells the story of Boston boyhood friends Jimmy Winters (Joshua Koopman) and Sean Price (Chinaza Uche). Landscapers by day, and two-man stick up crew by night.",Gritty ‘How to Rob’ a winning debut from Boston writer-director Peter Horgan,"MOVIE REVIEW
How to Rob
Not Rated. At the Somerville Theater.
Grade: B+
Shot in 12 days in Boston and on the Cape and recipient of audience awards as IFFBoston and the New Hampshire Film Festival… [+3045 chars]",https://www.bostonherald.com/2023/01/12/gritty-how-to-rob-a-winning-debut-from-boston-writer-director-peter-horgan/
tt0050083,Tory Lanez’s father has revealed that his son has forgiven Megan Thee Stallion despite facing a lengthy prison sentence over allegations that he shot her.,"Tory Lanez Has 'Forgiven' Megan Thee Stallion Despite Shooting Conviction, Says His Father","Tory Lanez’s father has revealed that his son has forgiven Megan Thee Stallion despite facing a lengthy prison sentence over allegations that he shot her.
Sonstar Peterson uploaded a video on Instag… [+3896 chars]",https://hiphopdx.com/news/tory-lanez-forgives-megan-thee-stallion-shooting-sonstar-peterson
tt0050083,"The bowerbird, which lives on the east coast of Australia, has an abiding eye for anything blue. Solitary males travel great distances to bring back all manner of blue objects to decorate their nests. Shells, flowers, plastic bottles, and feathers are all fai…",More Than Just an Object: A Collector’s Reading List,"The bowerbird, which lives on the east coast of Australia, has an abiding eye for anything blue. Solitary males travel great distances to bring back all manner of blue objects to decorate their nests… [+11674 chars]",http://longreads.com/2023/01/05/more-than-just-an-object-a-collectors-reading-list/
tt0050083,The unnamed child in China was rushed to hospital after inserting the medical device into his penis while masturbating and suffering severe pain for nine hours when it got stuck.,"Chinese boy, 12, needs a THERMOMETER pulled out of his penis","A 12-year-old Chinese boy needed urgent medical attention after a bizarre sexual experiment with a thermometer went horribly wrong.
The unnamed child was rushed to hospital after inserting the medic… [+4380 chars]",https://www.dailymail.co.uk/health/article-11582809/Chinese-boy-12-needs-THERMOMETER-pulled-penis.html
tt0050083,"This week in Reading The Wheel of Time, Cadsuane interrogates Merana, Min and Rand share news of death and comfort each other, and Sevanna plays with fire. Weaves of fire, which she can’t even see. Hmm. I think that metaphor got away from me. Kind of how the …",Reading The Wheel of Time: New Old Faces in Robert Jordan’s A Crown of Swords (Part 12),"This week in Reading The Wheel of Time, Cadsuane interrogates Merana, Min and Rand share news of death and comfort each other, and Sevanna plays with fire. Weaves of fire, which she cant even see.
H… [+25651 chars]",https://www.tor.com/2023/01/31/reading-the-wheel-of-time-new-old-faces-in-robert-jordans-a-crown-of-swords-part-12/
tt0050083,"Almaty’s journalists witnessed Kazakhstan’s largest city roil with protests, peaceful at first, then become engulfed in deepening anger and shocking violence.","Kazakhstan’s Bloody January: Day 6, Almaty","Advertisement
One year ago, state media largely ignored the biggest outbreak of civil unrest in Kazakhstans history. The job of informing the public objectively about the widespread protests fell on… [+22707 chars]",https://thediplomat.com/2023/01/kazakhstans-bloody-january-day-6-almaty/
tt0050083,"Generally in higher-income economies, worries about food are relatively nonexistent and life expectancy is longer. The U.S. is the exception to this rule.","U.S. ranks below China, Latvia, and Mauritius for women’s health","As it turns out, money cant buy happiness or health. Despite throwing the most money in the world at healthcare, the U.S. ranks below China, Latvia, and Mauritius for womens health.
According to dat… [+4201 chars]",https://fortune.com/2023/01/25/us-ranks-behind-latvia-china-womens-health-index-more-stressed-worried-angry-sad-than-past-decade/
tt0050083,"My goal at the beginning of 2022 was to read at least ONE book a month… which in theory, seems like a pretty easy goal to accomplish. However, prioritizing reading was not high on my list, so I had to figure out a way to make it a priority in order to reach m…",Books I Read in 2022… and Reading Recommendations,"My goal at the beginning of 2022 was to read at least ONE book a month… which in theory, seems like a pretty easy goal to accomplish. However, prioritizing reading was not high on my list, so I had t… [+8534 chars]",https://lovemaegan.com/books-i-read-in-2022-and-reading-recommendations/
tt0050083,"America is suffering from a pandemic that is not a virus, it “is a pandemic of fatherlessness.” That’s according to Pastor Kris Vallotton, author of... Read More
The post America Has a ‘Pandemic of Fatherlessness’ Contributing to Gender Confusion, Suicide, an…","America Has a ‘Pandemic of Fatherlessness’ Contributing to Gender Confusion, Suicide, and More, Author Says","America is suffering from a pandemic that is not a virus, it is a pandemic of fatherlessness. Thats according to Pastor Kris Vallotton, author of the new book Uprising: The Epic Battle for the Most F… [+23167 chars]",https://www.dailysignal.com/2023/01/09/america-has-pandemic-fatherlessness-contributing-gender-confusion-suicide-author-says/
tt0050083,"Protesters tear down fence around Channel 13 reporters, tell them 'we don't want you here'; National Unity's Benny Gantz also harassed at the scene",‘Leftists go home’: Crowd accosts news crew at site of Jerusalem terror attack,"An angry crowd accosted a television news crew in Jerusalem on Saturday, berating the journalists as “leftists” and telling them to leave the area as the reporters covered a terror attack that happen… [+6039 chars]",https://www.timesofisrael.com/leftists-go-home-crowd-accosts-news-crew-at-site-of-jerusalem-terror-attack/
tt0050083,"Prince Harry’s ghostwriter, JR Moehringer, is a Pulitzer Prize-winning features writer whose own memoir about his absent father was adapted into a George Clooney-directed film. Now he’s turned his hand to ferreting out the most intimate details of royal life …",JR Moehringer grew up with a love of The Prince and the Pauper. Now he’s written Prince Harry’s memoir,"Stay ahead of the trend in fashion and beyond with our free weekly Lifestyle Edit newsletter
Stay ahead of the trend in fashion and beyond with our free weekly Lifestyle Edit newsletter 
The two bo… [+10443 chars]",https://www.independent.co.uk/life-style/royal-family/jr-moehringer-spare-ghostwriter-harry-b2260901.html
tt0050083,"Nicolas Cage has tackled a wide variety of genres over the course of his career, but he only recently dipped...
The post The Old Way clips: Nicolas Cage is a gunslinger out for revenge appeared first on JoBlo.",The Old Way clips: Nicolas Cage is a gunslinger out for revenge,"Nicolas Cage has tackled a wide variety of genres over the course of his career, but he only recently dipped his toe into the world of Westerns. One of his first will be The Old Way, and Lionsgate ha… [+2288 chars]",https://www.joblo.com/the-old-way-clips-nicolas-cage-is-a-gunslinger-out-for-revenge/
tt0050083,Four members of the group were found guilty of seditious conspiracy for their role in seeking to block the transfer of power after the 2020 presidential election in the second major sedition trial involving the group.,Jury convicts far-right Oath Keepers for US Capitol attack,"A 12-member jury in Washington, D.C., on Monday, found four members of the Oath Keepers, a far-right militia group, guilty of seditious conspiracy for their role in storming the US Capitol on January… [+4265 chars]",https://www.dw.com/en/jury-convicts-far-right-oath-keepers-for-us-capitol-attack/a-64493727
tt0050083,"Our chief film critic watched over 150 new releases in 2022, and these are his picks for the best 15 movies of the year.",Critic’s Picks: The Best Movies of 2022,"By Rob Hunter · Published on January 30th, 2023 
This article is part of our 2022 Rewind. Follow along as we explore the best and most interesting movies, shows, performances, and more from this ver… [+16478 chars]",https://filmschoolrejects.com/best-movies-critics-picks-2022/
tt0050083,Her body is riddled with bullet hole scars and specks of shrapnel. Just beneath the skin on her waist and chest are two lumps of leftover ammunition. Yet Natasha LaTour is still alive -- believed to be the lone survivor of a suspected serial killer.,Her alleged attacker is a suspected serial killer. She forgives him but not the police,Her body is riddled with bullet hole scars and specks of shrapnel. Just beneath the skin on her waist and chest are two lumps of leftover ammunition. Yet Natasha LaTour is still alive believed to be … [+7891 chars],https://www.cnn.com/2023/01/11/us/stockton-california-serial-killer-survivor/index.html
tt0050083,"""Mixed in with the compulsive consumption of cigarettes and pot were 12 cans of Tab daily and forays into diet pills, champagne ... popcorn and cupcake icing.""",I Compulsively Consumed Everything From Vodka To Juicy Fruit. Here's What I Know About Addiction.,"The author is shown back in her smoking days.
Where the hell are you? I yelled, banging on his door at 3 a.m. I couldnt believe he was mind-fucking me after hed just told me to travel an hour to see… [+9637 chars]",https://www.huffpost.com/entry/addiction-compulsive-consumption_n_63b471fde4b0fe267cab6dd7
tt0050083,"Having raised her kids in a Shanghai school, expat mother back home in America longs for the structure and protection of Chinese society
The post Mom Misses Chinese Communist Child-Raising Help appeared first on The American Conservative.",Mom Misses Chinese Communist Child-Raising Help,"I went to this NYT op-ed by Heather Kaye expecting to hate it ... but in fact, she gives us a lot to think about. She and her husband lived for the past 16 years in Shanghai, but recently returned to… [+13469 chars]",https://www.theamericanconservative.com/mom-misses-chinese-communist-child-raising-help/
tt0050083,"The frequency of mass shootings and the variety of places in which they now take place — at offices and schools, nail salons and houses of worship, grocery stores and restaurants — contributes to the sense, prevalent across America, that such violence could b…",‘Tragedy upon tragedy’: January brings dozens of mass shootings so far,"The deadliest shooting so far took place over the weekend in Monterey Park, Calif., a city with a thriving Asian American community, where a gunman killed 11 people and wounded nine others inside a p… [+5523 chars]",https://www.bostonglobe.com/2023/01/24/nation/tragedy-upon-tragedy-january-brings-dozens-mass-shootings-so-far/
tt0050083,Australian states and territories are moving to ban Nazi symbols. But can such laws cover a Nazi salute? Here are the difficulties in drafting and enforcing such legislation.,Would a law banning the Nazi salute be effective – or enforceable?,"Amid the growing threat of far-right extremism in Australia, Victoria recently became the first state to ban the Nazi swastika, (known as the Hakenkreuz). Publicly displaying the symbol is now a crim… [+6189 chars]",https://theconversation.com/would-a-law-banning-the-nazi-salute-be-effective-or-enforceable-198143
tt0050083,Wellness rhetoric functions as a Trojan horse to smuggle in a more sinister agenda,Why influencers like Andrew Tate want your sons’ attention,"Andrew Tate has made headlines in recent weeks following his arrest by Romanian police on charges of sex trafficking and sexual abuse. He appeared on the public radar last year, having racked up almo… [+6929 chars]",https://www.irishtimes.com/opinion/2023/01/24/why-influencers-like-andrew-tate-want-your-sons-attention/
tt0050083,"The second wave of the lineup also includes films ""Bottoms"" and ""Tetris.""",SXSW 2023 Announces Opening and Closing Night TV Selections with Donald Glover’s ‘Swarm’ and Lee Sung Jin’s ‘Beef’,"The 2023 South by Southwest Festival has officially unveiled its second wave of headliners and TV premieres, including Opening and Closing Night episodic selections.
Set to take place March 10 throu… [+36031 chars]",https://www.indiewire.com/2023/02/sxsw-2023-lineup-tv-opening-night-closing-night-premiere-1234805751/
tt0050083,"In 1995 a honeymoon home video made by Pamela Anderson and Tommy Lee was stolen and distributed, becoming a global sensation. Here's what she has said about it.",What Pamela Anderson Has Said About That Infamous Sex Tape in Her Own Words,"In the documentary Pamela, A Love Story, Pamela Anderson looks back at her rise to fame and some of her biggest highs and lows.
One event that put her under fierce public scrutiny was the theft and … [+3091 chars]",https://www.newsweek.com/what-pamela-anderson-has-said-about-sex-tape-tommy-lee-pamela-love-story-netflix-1776828
tt0050083,"From boxing gyms to train stations, Streetcasters are plucking people from obscurity and giving them leading roles. Here, the best tell all – including why they’re always mistaken for the policeWhen Lucy Pardee was tasked with finding a young Scottish girl to…",‘Our best tip-off was Greggs in Bolton’: the secrets behind finding the hottest new screen stars,"When Lucy Pardee was tasked with finding a young Scottish girl to play the lead in the film Aftersun, her usual methods were off-limits. Without Covid, she would have been in schools and youth clubs,… [+9292 chars]",https://www.theguardian.com/tv-and-radio/2023/jan/06/our-best-tip-off-was-greggs-in-bolton-the-secrets-behind-finding-the-hottest-new-screen-stars
tt0050083,"After SBM suffered the unexpected loss of our co-founder Dr. Harriet Hall last week, we were angered and distressed to see antivaxxers saying that she had ""died suddenly"" because of COVID-19 vaccines. This dangerous narrative is even more painful when it targ…",When antivax “died suddenly” conspiracy mongering vultures target a friend and colleague,"Dr. Harriet Hall (b. July 2, 1945; d. January 11, 2023)and friendat TAM in 2011.
After I got over the initial shock and sadness that hit me after I learned of the unexpected death of our friend and … [+31326 chars]",https://sciencebasedmedicine.org/when-antivax-died-suddenly-conspiracy-mongering-vultures-target-a-friend-and-colleague/
tt0050083,"A version of this story about production design first appeared in the Below-the-Line issue of TheWrap’s awards magazine. Movies are distinguished by their scope and vision, but some of the most memorable films in history have gained power by focusing on a sin…","From ‘The Whale’ to ‘Babylon,’ How Production Designers Created Power and Emotion Using Single Locations","A version of this story about production design first appeared in the Below-the-Line issue of TheWraps awards magazine.
Movies are distinguished by their scope and vision, but some of the most memor… [+449 chars]",https://biztoc.com/x/dabc39872f4ef302
tt0050083,"The paintings lining the walls of the Michigan Capitol tell a story of power, of the primarily white men who — year after year, decade after decade — have dominated the state’s political landscape.

There are the exceptions: The portrait of Eva McCall Hamilto…","After years of misogyny, racism and threats, progressive women are in charge in Michigan","The paintings lining the walls of the Michigan Capitol tell a story of power, of the primarily white men who year after year, decade after decade have dominated the states political landscape.
There… [+47985 chars]",https://www.rawstory.com/michiga-s-new-women-in-politics/
tt0050083,"The actor, 60, appeared on BBC's The One Show to discuss his role in the show, where he plays a fisherman struggling with the death of his son in an accident several years before.","Jason Watkins discusses death of his daughter Maude, 2","Jason Watkins has discussed the death of his daughter Maude and how it releated to his role in new Channel 5 series The Catch.
The actor, 60, appeared on BBC's The One Show to discuss his role in th… [+6110 chars]",https://www.dailymail.co.uk/tvshowbiz/article-11671193/Jason-Watkins-discusses-death-daughter-Maude-2.html
tt0050083,"Are you dating a Cancer man — born between June and July 22nd — and wondering if they’re serious about you? Since cancer is a water sign, folks who fall under the “crab” stars can be difficult to read.  Although, they’re also known for being nurturing, depend…",23 Must-Know Signs A Cancer Man Is Serious About You,"Are you dating a Cancer man born between June and July 22nd and wondering if theyre serious about you?
Since cancer is a water sign, folks who fall under the crab stars can be difficult to read. 
A… [+13148 chars]",https://liveboldandbloom.com/01/relationships/cancer-man-likes-you
tt0050083,"According to the former U.S. House of Representatives' general counsel who served the Democratic-led chamber during Donald Trump's administration, his hope is that sanity will once again prevail after having worked on two impeachments and the investigation of…",Trump 'ignorance' slammed by architect of J6 committee's investigation,"That, however, is changing in Michigan. And when the states 102nd Legislature convened for the first time last week, its makeup changed dramatically.
After a 2018 constitutional amendment led to par… [+47185 chars]",https://www.rawstory.com/donald-trump-ignorance-2659290922/
tt0050083,"Treasury Secretary Janet Yellen said Saturday the histories of the United States and Africa were ""intimately connected"" by the ""tragedy"" of slavery, as Washington seeks to strengthen relations with the continent.Speaking at Goree Island off the Senegalese cap…","US, Africa histories 'intimately connected' by slavery: Janet Yellen","That, however, is changing in Michigan. And when the states 102nd Legislature convened for the first time last week, its makeup changed dramatically.
After a 2018 constitutional amendment led to par… [+47185 chars]",https://www.rawstory.com/us-africa-histories-intimately-connected-by-slavery-janet-yellen/
tt0050083,"The publisher of the small newspaper that raised red flags about George Santos' bid for a House seat appeared on MSNBC Saturday morning and recalled an alarming first meeting with the then-candidate who came seeking his paper's endorsement.

Speaking with hos…",Publisher freaked out early by 'weirdo' George Santos describes alarming first meeting,"That, however, is changing in Michigan. And when the states 102nd Legislature convened for the first time last week, its makeup changed dramatically.
After a 2018 constitutional amendment led to par… [+47185 chars]",https://www.rawstory.com/george-santos-2659290820/
tt0050083,"Jamie Carragher has taken aim at Kia Joorabchian and his role at Everton after the sacking of Frank Lampard - and would welcome a call from the agent, who he's clashed with in the pass","Jamie Carragher ""waiting"" for Kia Joorabchian phone call after brutal Everton comments","Jamie Carragher insists he will welcome a phone call from Kia Joorabchian after he took aim at the agent and his relationship with Everton. 
 The Toffees are sat in the bottom three and sacked Frank… [+2830 chars]",https://www.mirror.co.uk/sport/football/news/jamie-carragher-kia-joorabchian-everton-29032266
tt0050083,"In Las Vegas, a lawyer with huge gambling debts is accused of a financial fraud that left hundreds of victims in its wake",An alleged $500 million Ponzi scheme preyed on Mormons. It ended with FBI gunfire. - The Washington Post,"Comment on this story
LAS VEGAS The FBI arrived at the only house on this stretch of Ruffian Road at 1:25 p.m., parking out front of the $1.6 million property, hedged by empty lots of scrub and dust… [+28214 chars]",https://www.washingtonpost.com/dc-md-va/2023/02/01/mormon-ponzi-scheme-vegas-fbi/
tt0050083,"Your body language accounts for 55% of what others take away from you, while your words only account for 7%. Yet most of us only learn body language informally. What if we studied what experts have…",13 Body Language Tips for Young Professionals to Be More Influential,"13 Body Language Tips for Young Professionals to Be More Influential
A tiny improvement in body language could mean a massive improvement in how influential you are.
Your body language accounts for… [+5281 chars]",https://betterhumans.pub/13-body-language-tips-for-young-professionals-to-be-more-influential-751b27e30662
