tt1375666,"Paycom is a payroll and HR technology provider focusing on user experience, ease of implementation, and employee-managed data. Founded at the inception of the dot-com bubble in 1998, it’s considered one of the first fully online payroll companies. Paycom’s pa…",Paycom Review,"Paycom is a payroll and HR technology provider focusing on user experience, ease of implementation, and employee-managed data. Founded at the inception of the dot-com bubble in 1998, it’s considered … [+13271 chars]",https://www.quicksprout.com/paycom-review/
tt1375666,"Amazon delivers packages in less than half the time that rivals like Walmart and Target do, per NielsenIQ data compiled by Insider Intelligence.",This chart shows just how much faster Amazon still delivers your packages despite years of effort by other retailers,"Walmart, Target, and other stores have sped up their shipping times during the pandemic. But when it comes to speed, Amazon still has an advantage.
As of July, customers received their Amazon orders… [+2005 chars]",https://www.businessinsider.com/amazon-package-delivery-speed-walmart-target-2023-1
tt1375666,"The Camel Trophy and its iconic sandglow Land Rovers traveled to Mongolia for the 1997 round of the brutal off-road competition. The format of the event was changed for the first time since its inception in 1980, with teams mapping...",1997 Land Rover Discovery Camel Trophy SUV,"In 2019, a team of former investment bankers, scholars, and journalists set out to disrupt the tired world of finance and investing media. Frustrated with clickbait stories designed to incite fear an… [+567 chars]",https://uncrate.com/1997-land-rover-discovery-camel-trophy-suv/
tt1375666,"Since its inception, Lenovo's Yoga Books have defied easy categorization thanks to their multi-function form factors. The 2023 Yoga Book 9i continues this tradition. As the first full-sized OLED dual-screen laptop, it has a pair of 13.3-inch 2.8K displays tha…",Lenovo Yoga Book 9i Dual Screen Laptop,"Nearly 40 percent of Americans have some sort of sleep disorder, and that lack of sleep negatively affects your mental abilities, emotional state, and overall health. To help you get those much-neede… [+616 chars]",https://uncrate.com/lenovo-yoga-book-9i-dual-screen-laptop/
tt1375666,"Bridgewater has doubled its fund assets in China to more than 20 billion yuan ($2.93 billion) over the past year, according to two sources and government data, a feat that cements its position as the biggest foreign hedge fund in the country.",Dalio's Bridgewater cements rank in 2022 as top foreign hedge fund ... - Reuters,"HONG KONG/SHANGHAI, Jan 10 (Reuters) - Bridgewater has doubled its fund assets in China to more than 20 billion yuan ($2.93 billion) over the past year, according to two sources and government data, … [+3187 chars]",https://www.reuters.com/business/finance/dalios-bridgewater-cements-rank-2022-top-foreign-hedge-fund-china-2023-01-10/
tt1375666,Refresh your home decor with the help of the maker-driven platform.,8 Home Goods From Etsy That Could Be From A High-End Design Store,"The start of a new year seems to come preloaded with the desire to refresh. New year, new beginnings. For some folks that may spur a new workout regime or a new hobby. For some it might mean a change… [+779 chars]",https://www.huffpost.com/entry/best-etsy-home-decor_l_63d2c8f2e4b01e9288696efe
tt1375666,"Since its inception in the '60s, Sanrio has stood the test of time, with its adorable Japanese icons remaining some of fashion's most sought-after characters. There's always some sort of Sanrio-designer collab on the market — and yet, it's one of those things…",The Mulberry x Miffy Lunar New Year Collab Is Just Too Good,"Photo: Courtesy of Mulberry/ Artwork: India Roby/Fashionista
Since its inception in the '60s, Sanrio has stood the test of time, with its adorable Japanese icons remaining some of fashion's most sou… [+1744 chars]",https://fashionista.com/2023/01/mulberry-miffy-lunar-new-year-collaboration
tt1375666,"No one is more prepared than Batman. Everyone's favorite billionaire goth boy has backup plans for his backup plans, which include everything from drafting a ""How to Kill Your Justice League Buddies for Dummies"" guide, to a trusty can of Shark Repellant. In a…",Christopher Nolan Brought Lessons From Inception And The Prestige To His Dark Knight Trilogy,"No one is more prepared than Batman. Everyone's favorite billionaire goth boy has backup plans for his backup plans, which include everything from drafting a ""How to Kill Your Justice League Buddies … [+843 chars]",https://www.slashfilm.com/1183068/christopher-nolan-brought-lessons-from-inception-and-the-prestige-to-his-dark-knight-trilogy/
tt1375666,AEW Dynamite has seen its fair share of loaded match cards since its inception in 2019 but one would be hard-pressed to find one more brimming with...,"AEW Dynamite Results: Winners, Grades, Reaction and Highlights from January 11","AEW presented a PPV-worthy card Wednesday night in its Los Angeles debut.Credit: All Elite Wrestling
AEW Dynamite has seen its fair share of loaded match cards since its inception in 2019 but one wo… [+532 chars]",https://bleacherreport.com/articles/10060957-aew-dynamite-results-winners-grades-reaction-and-highlights-from-january-11
tt1375666,"We bite our knuckles because we won't see this rakishly handsome EV stateside. The new Peugeot Inception actually showed itself at CES 2023, and it's all kinds of cool with sharp tail section, a massive windshield that extends down to the floor, capped by an …",Peugeot Inception,"We bite our knuckles because we won’t see this rakishly handsome EV stateside. The new Peugeot Inception actually showed itself at CES 2023, and it’s all kinds of cool with sharp tail section, a mass… [+952 chars]",https://coolmaterial.com/rides/peugeot-inception/
tt1375666,"The College Board released Wednesday the official framework of a new Advanced Placement course on African American Studies that Florida Gov. Ron DeSantis earlier denounced for imposing a ""political agenda.""",College Board unveils official framework for new AP African American studies course,The College Board released Wednesday the official framework of a new Advanced Placement course on African American Studies that Florida Gov. Ron DeSantis earlier denounced for imposing a political ag… [+6796 chars],https://www.cnn.com/2023/02/01/us/college-board-ap-african-american-studies/index.html
tt1375666,"Universities are using their massive endowments, boosted by hefty tuition dollars, to invest in commercial real estate as property values fall.","The University of California invested $4 billion with Blackstone to buy up rental apartments and student housing, which they see as the bright spots in the real estate market this year","The University of California is investing $4 billion in a real estate fund managed by private equity firm Blackstone to acquire rental and student housing, which both entities see as bright spots in … [+2924 chars]",https://www.businessinsider.com/university-of-california-invests-4-billion-with-blackstone-2023-1
tt1375666,Looking to level up your free time? Check out what's playing on Entrepreneur TV this week!,What's on Entrepreneur TV This Week,"Looking to add some entrepreneurial entertainment to your day? We've got just the thing. Grab some popcorn and head over to Entrepreneur TV, and check out what's playing this week!
Monday, Wednesday… [+2781 chars]",https://www.entrepreneur.com/living/whats-on-entrepreneur-tv-this-week/443355
tt1375666,"La firme au lion profite du CES de Las Vegas pour présenter un concept-car qui annonce le futur de Peugeot. Au programme : une puissante motorisation de 680 ch, une batterie de 100 kWh, une autonomie de 800 km et un système de conduite autonome de niveau 4. «…",Peugeot Inception : 800 km d’autonomie et une charge ultrarapide pour 2025,"La firme au lion profite du CES de Las Vegas pour présenter un concept-car qui annonce le futur de Peugeot. Au programme : une puissante motorisation de 680 ch, une batterie de 100 kWh, une autonomie… [+6158 chars]",https://www.frandroid.com/marques/peugeot/1580654_peugeot-inception-800-km-dautonomie-et-une-charge-ultrarapide-pour-2025
tt1375666,"Parmi les stars du CES de Las Vegas cette année, une création bien de chez nous, le concept-car Peugeot Inception. Sous une allure franchement futuriste, il cache de nombreux indices sur les voitures électriques Peugeot de demain. Nous l’avons vu de près et e…",Peugeot Inception : on a vu la voiture électrique française du futur,"Parmi les stars du CES de Las Vegas cette année, une création bien de chez nous, le concept-car Peugeot Inception. Sous une allure franchement futuriste, il cache de nombreux indices sur les voitures… [+6117 chars]",https://www.frandroid.com/marques/peugeot/1589019_peugeot-inception-on-a-vu-la-voiture-electrique-francaise-du-futur
tt1375666,The Inception is a mobile lounge.,Peugeot's wild new concept could be the car of the future,"Although car design has evolved massively over the decades, today's vehicles still don't quite look like the models that authors and filmmakers imagined we would be driving more than two decades into… [+2428 chars]",https://www.creativebloq.com/news/ces-peugeot-inception-concept
tt1375666,"La marque française Peugeot se lâche et lance un concept-car futuriste 100% électrique avec un volant rétractable. 
Ce concept-car de Peugeot peut rouler sans volant",Ce concept-car de Peugeot peut rouler sans volant,"La marque française Peugeot se lâche et lance un concept-car futuriste 100% électrique avec un volant rétractable.Peugeot veut penser à lavenir. Le CES, salon de linnovation de Las Vegas, est lendroi… [+2581 chars]",https://www.journaldugeek.com/2023/01/10/ce-concept-car-de-peugeot-peut-rouler-sans-volant/
tt1375666,"Peugeot has for years been adding serious lion-ish ferocity to its cars, with design elements like triple-claw headlights and slashed DRLs. We thought that trend might have found its ultimate conclusion in the absolutely feral 9X8 race car, but we were wrong.…",Radical Peugeot Inception looks like it was carved by katana,"Peugeot has for years been adding serious lion-ish ferocity to its cars, with design elements like triple-claw headlights and slashed DRLs. We thought that trend might have found its ultimate conclus… [+3450 chars]",https://newatlas.com/automotive/radical-peugeot-inception-concept/
tt1375666,Le nouveau concept de Peugeot annonce un virage majeur pour la marque au Lion.,Peugeot Inception : voilà à quoi ressembleront les Peugeot électriques en 2025,"Le nouveau concept de Peugeot annonce un virage majeur pour la marque au Lion.On lattendait au Mondial de lAuto à Paris, mais cest à Las Vegas que Peugeot a choisi de faire le show. La marque françai… [+2608 chars]",https://www.01net.com/actualites/peugeot-inception-voila-a-quoi-ressembleront-les-peugeot-electriques-en-2025.html
tt1375666,"Nach Verlegung der Detroit Motorshow in den Sommer bleibt nur die CES als Gelegenheit für Autohersteller, sich zu Jahresbeginn zu präsentieren.","CES: BMW, Mercedes und Co. auf der CES 2023: Die Autobranche auf der Elektronikmesse","Inhaltsverzeichnis
Auf der früher ""Consumer Electronics Show"" genannten CES ist vieles anders als von Automessen gewohnt. Logisch, denn sie ist ja ursprünglich gar keine Veranstaltung der Autoindust… [+6282 chars]",https://www.heise.de/news/CES-2023-Die-Autobranche-auf-der-amerikanischen-Elektronikmesse-7445930.html
tt1375666,"After each high-profile crypto meltdown, there have been renewed calls for greater oversight of the space. The idea here is that if we regulated crypto players like traditional financial institutions, they would start behaving like ones. But a regulatory fram…",Do Crypto Prices Actually Mean Anything?,"The proliferation of fraud, scams, and meltdowns suggest that they don’t — but price isn’t the only way to measure real-world value.
""&gt;
The events of 2022 have called into question whether crypt… [+10062 chars]",https://hbr.org/2023/01/do-crypto-prices-actually-mean-anything
tt1375666,Democrat Kris Mayes will repurpose unit created by Republican predecessor to focus on protecting voting accessA unit created under the former Republican attorney general of Arizona to investigate claims of election fraud will now focus on voting rights and ba…,Arizona’s new attorney general to use election fraud unit to boost voting rights,A unit created under the former Republican attorney general of Arizona to investigate claims of election fraud will now focus on voting rights and ballot access under the newly elected Democratic att… [+3905 chars],https://www.theguardian.com/us-news/2023/jan/21/arizona-election-unit-voting-rights-attorney-general
tt1375666,"Father Joe arrived in Bangkok in the 1970’s. Fifty years, 15 schools and 30,000 students later, he credits the community with saving him“This other priest is always drunk, so you go take his place.”With that simple instruction, Joseph H Maeir, a Catholic prie…",‘I was a drunk for 20 years’: The unlikely US priest revered in the slums of Bangkok,"This other priest is always drunk, so you go take his place.
With that simple instruction, Joseph H Maeir, a Catholic priest from the United States, found himself in Thailand, ending up in the slums… [+4212 chars]",https://www.theguardian.com/world/2023/jan/28/i-was-a-drunk-for-20-years-the-unlikely-us-priest-revered-in-the-slums-of-bangkok
tt1375666,"From colonies on distant planets to Pokemon with guns, the survival genre is bringing a massive breadth of experiences that anyone can enjoy in 2023.",Biggest Upcoming Survival Games in 2023 and Beyond,"The survival genre has pumped out some incredible experiences since its inception. No Mans Sky, Rust, Minecraft, and more have defined and expanded on the immersive formula of trying to forge your wa… [+136 chars]",https://www.gamespot.com/videos/biggest-upcoming-survival-games-in-2023-and-beyond/2300-6460336/
tt1375666,"Piyush Goyal was speaking at the B20 India Inception Meeting in Gandhinagar, Gujarat.","Apple looking to scale up manufacturing in India to 25%, says Commerce Minister Piyush Goyal",Union Commerce and Industry Minister Piyush Goyal said Monday that iPhone maker Apple was looking to scale up manufacturing in India to 25 per cent.Apple is a success story. They are already doing 5-… [+937 chars],https://indianexpress.com/article/india/apple-scale-manufacturing-india-commerce-minister-piyush-goyal-8399921/
tt1375666,"Elon Musk's Boring Company, which aims to create tunnels to cut down on traffic congestion in cities, has completed just one of six known projects.",Infrastructure innovation derailed: How Facebook's failed plan to turn a century-old railway into a commuter bridge may serve as a warning for The Boring Company,Facebook's failed plans to revive an old railway bridge to ease traffic congestion near its offices are among the latest stumbling points facing future-looking tech companies as they try their hands … [+5113 chars],https://www.businessinsider.com/facebooks-failed-bridge-glimpse-at-future-of-the-boring-company-2023-1
tt1375666,,"Twitter’s Infrastructure Continues to Crumble, Silently","David Frum, on Twitter:


 I’m doing an experiment. On my computer, I am checking the latest
tweets by people I follow. On my phone, I’m checking whether their
most recent tweets are showing up in th… [+2240 chars]",https://twitter.com/davidfrum/status/1616892096434012160
tt1375666,The Business 20 Inception meeting at Gandhinagar is the first of 15 G20 meetings being hosted by Gujarat.,"2023 will be full of challenges like inflation, says Union minister Piyush Goyal at B20 India meeting","Union Minister for Commerce and Industry Piyush Goyal said Monday that the year 2023 will be full of challenges, including inflation. He was speaking on the sidelines of a B20 India Inception Meeting… [+1192 chars]",https://indianexpress.com/article/cities/gandhinagar/2023-challenges-inflation-piyush-goyal-b20-india-meeting-8399671/
tt1375666,"While the stock market and the economy have been subdued by progressive interest-rate increases, AbbVie Inc. (ABBV) has not only reported a robust third quarter but also demonstrated its confidence...",The No. 1 Pharma Stock to Buy in January 2023,"While the stock market and the economy have been subdued by progressive interest-rate increases, AbbVie Inc. (ABBV) has not only reported a robust third quarter but also demonstrated its confidence i… [+6024 chars]",https://stocknews.com/news/abbv-jnj-pfe-bmy-the-no-1-pharma-stock-to-buy-in-january-2023/
tt1375666,A fresh single ahead of an appearance at the Grammys this weekend,Glorilla Shares New Song “Internet Trolls”: Listen,"Glorilla has shared a new song titled Internet Trolls. The fresh single arrives ahead of her performance at the Grammys this weekend, where shell join Missy Elliott, the Roots, Future, and Lil Wayne … [+459 chars]",https://pitchfork.com/news/glorilla-shares-new-song-internet-trolls-listen/
tt1375666,Sam Trabucco stepped down as co-CEO of Alameda Research months before the hedge fund's collapse. He said he was going to sail on his new yacht.,"Meet Sam Trabucco, the Alameda exec who oversaw the development of the crypto hedge fund's ultra-risk trading strategies","Sam Trabucco stepped down as the co-CEO of trading firm Alameda Research in August, just months before Sam Bankman-Fried's crypto empire filed for bankruptcy and lost $8 billion of customer money.
A… [+4570 chars]",https://markets.businessinsider.com/news/currencies/meet-sam-trabucco-alameda-research-exec-who-oversaw-alameda-research-crypto-2023-1
tt1375666,"Apple also leads this year's Writers Guild of America award nominations, boasting 12 nominations across seven series.SeveranceApple's lauded psychological thriller ""Severance"" was awarded seven nominations in total in the following categories: Read more...",Apple Original 'Severance' nominated for Outstanding Performance by an Ensemble SAG Award,"Severance
AppleInsider may earn an affiliate commission on purchases made through links on our site.
Apple also leads this year's Writers Guild of America award nominations, boasting 12 nominations… [+1298 chars]",https://appleinsider.com/articles/23/01/12/apple-original-severance-nominated-for-outstanding-performance-by-an-ensemble-sag-award
tt1375666,"Le concept Inception, dévoilé au CES, dispose d’un volant qui ne ressemble à aucun autre. L'Hypersquare fusionne en quelque sorte la navigation et le tableau de bord. On vous explique tout ça. Au CES de Las Vegas, Peugeot a présenté le 6 janvier son concept-c…",Les futurs volants de Peugeot pourraient ressembler à… la Nintendo Switch,"Le concept Inception, dévoilé au CES, dispose dun volant qui ne ressemble à aucun autre. LHypersquare fusionne en quelque sorte la navigation et le tableau de bord. On vous explique tout ça.
Au CES … [+4908 chars]",https://www.numerama.com/vroom/1229566-les-futurs-volants-de-peugeot-pourraient-ressembler-a-la-nintendo-switch.html
tt1375666,“Pretendians” are undermining people who actually need a platform and hurting the legitimacy of all Indigenous movements.,A Wisconsin Activist Just Got Accused Of Cosplaying A Person of Color,"RachelDolezaland Oli Londonare just a couple of examples from the concerning amount of white people who have recently cosplayed people of color for clout. The latest appears to be Kay LeClaire, a lea… [+3169 chars]",https://www.huffpost.com/entry/indigenous-wisconsin-fake-identity-lie_n_63b5e123e4b0fe267cad1bf8
tt1375666,"The airline, a joint venture between Tata Sons and Singapore Airlines, reported an operating profit for the first time since inception in the three months ended December 2022.",Vistara to have 70 planes in fleet by mid-2024: CEO Vinod Kannan,"Full service carrier Vistara will continue to expand and expects to have a total of 70 planes by mid-2024, its chief Vinod Kannan said on Tuesday.The airline, a joint venture between Tata Sons and Si… [+1064 chars]",https://indianexpress.com/article/business/vistara-airlines-ceo-vinod-kannan-8401891/
tt1375666,"Alors que le CES 2023 bat son plein, la marque Peugeot a présenté un concept-car assez futuriste.",Peugeot Inception : découvrez le concept car qui va inspirer les prochains véhicules de la marque,"Alors que le CES 2023 bat son plein, la marque Peugeot a présenté un concept-car assez futuriste.
La voiture, baptisée « Inception », servira de base pour la production de ses futurs modèles électri… [+1984 chars]",https://www.clubic.com/peugeot/actualite-452646-peugeot-inception-decouvrez-la-concept-car-qui-va-inspirer-les-prochains-vehicules-de-la-marque.html
tt1375666,"If you aren’t au fait with OAMC, then you should be. Originally called Over All Master Cloth before reverting to the four letter acronym, the Parisian-Milanese label has undeniably been pushing boundaries when it comes to both self-expression and high quality…",OAMC Is Doing Fashion Its Own Way,"If you arent au fait with OAMC, then you should be. Originally called Over All Master Cloth before reverting to the four letter acronym, the Parisian-Milanese label has undeniably been pushing bounda… [+1335 chars]",https://www.highsnobiety.com/p/oamc-fw22-rework/
tt1375666,"If there’s one thing On has become renowned for during its relatively short life-span — aside from its ground-breaking sneakers, lightweight apparel, and having Roger Federer as its posterboy — it’s its futuristic designs. Whether in the form of its holy mids…",On’s Retail Experience Is London Bound,"If theres one thing On has become renowned for during its relatively short life-span aside from its ground-breaking sneakers, lightweight apparel, and having Roger Federer as its posterboy its its fu… [+1967 chars]",https://www.highsnobiety.com/p/on-running-london-store/
tt1375666,"According to the report by a court-appointed examiner for its bankruptcy proceedings, the collapsed cryptocurrency lending platform Celsius Network had cheated customers since its foundation as a public company in the United States, which it allegedly created…","Celsius was insolvent since inception, court-appointed examiner reveals","According to the report by a court-appointed examiner for its bankruptcy proceedings, the collapsed cryptocurrency lending platform Celsius Network had cheated customers since its foundation as a pub… [+308 chars]",https://biztoc.com/x/c1cc5c1c600e03d3
tt1375666,"Acolytes,   The Warhammer: 40K franchise is widely loved and adored by many, and we’re stoked to have the opportunity to work with the brand. Games Workshop has trusted us to craft a co-op game that respects the setting, whilst giving players a familiar yet f…",Trusting Fatshark with Warhammer 40k: Darktide (2020),"Acolytes,
The Warhammer: 40K franchise is widely loved and adored by many, and were stoked to have the opportunity to work with the brand. Games Workshop has trusted us to craft a co-op game that re… [+2091 chars]",https://www.fatshark.se/news/2021/4/19/trusting-fatshark-with-warhammer-40000-darktide-1
tt1375666,"It’s not often that products formed within a brand’s formative years survive the test of time, remaining a staple of its product offering well beyond inception. Despite being a rare occurrence, it’s one that Nike has committed itself to making a reality, show…",Lacing Up 50 Years of the Nike Blazer,"It's not often that products formed within a brand's formative years survive the test of time, remaining a staple of its product offering well beyond inception. Despite being a rare occurrence, it's … [+3067 chars]",https://www.highsnobiety.com/p/nike-blazer-50th-anniversary/
tt1375666,"Having been a fan of adidas SPEZIAL since its inception, I can say with confidence that its curator, Gary Aspden, certainly knows his menswear onions. In fact, the designer has taken an experimental sub-label to one of the brand’s most sought-after lines almo…","Finally, It’s adidas SPEZIAL Season!","Having been a fan of adidas SPEZIAL since its inception, I can say with confidence that its curator, Gary Aspden, certainly knows his menswear onions.
In fact, the designer has taken an experimental… [+1381 chars]",https://www.highsnobiety.com/p/adidas-spezial-ss23/
tt1375666,"Since its inception in 2015, submissions to the Comedy Wildlife Photography Awards (previously) have captured some of nature’s most hapless and humorous moments. The overall winner was Jennifer Hadley’s timely snap of a 3-month old lion cub tumbling down a tr…",Hapless Hangups and Silly Spoofs Abound in the 2022 Comedy Wildlife Photography Awards,"Highly Commended Winner, “Pegasus, the flying horse” © Jagdeep Rajput and Comedy Wildlife 2022
Since its inception in 2015, submissions to the Comedy Wildlife Photography Awards (previously) have ca… [+2333 chars]",https://www.thisiscolossal.com/2023/01/comedy-wildlife-photography-awards-2022/
tt1375666,"“The Boy, the Mole, the Fox and the Horse” harks back to an era of gentle storytelling and hand-drawn animation but its inception, by British illustrator Charlie Mackesy, was entirely modern: blossoming from social media to print to streaming. The book of the…","‘The Boy, the Mole, the Fox and the Horse’ Creator Charlie Mackesy Teases Possible Sequel, Reacts to Oscar Nomination","“The Boy, the Mole, the Fox and the Horse” harks back to an era of gentle storytelling and hand-drawn animation but its inception, by British illustrator Charlie Mackesy, was entirely modern: blossom… [+6271 chars]",https://variety.com/2023/awards/global/the-boy-the-mole-the-fox-and-the-horse-charlie-mackesy-oscars-1235501880/
