tt0120737,"Though we know him today as the author of The Hobbit and The Lord of the Rings—the creator of the fantastic Middle Earth, the inventor of hobbits and orcs and Elvish, indeed the ""father of modern fantasy literature""—Tolkien was also a respected medieval schol…",J.R.R. Tolkien (1892),"John Ronald Reuel Tolkien, CBE (/ˈtɒlkiːn/;[a] 3 January 1892 – 2 September 1973) was an English writer, poet, philologist, and university professor, best known as the author of the classic high fant… [+92645 chars]",https://encyclopedia.thefreedictionary.com/Tolkien%2c+J.+R.+R.
tt0120737,Everything being added to service in next 28 days,New on Netflix in February 2023: Every movie and TV series landing this month,"Sign up to our free IndyArts newsletter for all the latest entertainment news and reviews
Sign up to our free IndyArts newsletter
February is yet another stacked month for Netflix.
Not only are th… [+6942 chars]",https://www.independent.co.uk/arts-entertainment/tv/news/new-on-netflix-february-2023-b2274159.html
tt0120737,"Lyle, Lyle, Crocodile is part of the Netflix schedule for January 30-February 5. On Saturday, February 4, the streaming service will add the 2022 musical comedy to its available content. Lyle, Lyle, Crocodile is directed and produced by Will Speck and Josh Go…",Netflix Schedule January 30-February 5: New TV & Movies,"Lyle, Lyle, Crocodile is part of the Netflix schedule for January 30-February 5. 
On Saturday, February 4, the streaming service will add the 2022 musical comedy to its available content. Lyle, Lyle… [+2443 chars]",https://www.comingsoon.net/?p=1263336
tt0120737,All the new movies and shows we know are coming to Netflix in February 2023.,What’s Coming to Netflix in February 2023,"Illustration by What’s on Netflix
Welcome to the most comprehensive look ahead at all the new releases set to hit Netflix throughout the year’s shortest month. We’ll cover all the US additions plann… [+14218 chars]",https://www.whats-on-netflix.com/coming-soon/whats-coming-to-netflix-in-february-2023-01-26/
tt0120737,"Building graphical modeling tools can be a complex undertaking, especially if they need to support many features and functions. At Obeo, we have extensive experience in this area and strive to make the process as easy and accessible as possible. To accomplish…","Building Graphical Modeling Tools, Approaches to Reducing Complexity","Building graphical modeling tools can be a complex undertaking, especially if they need to support many features and functions. At Obeo, we have extensive experience in this area and strive to make t… [+6637 chars]",https://cedric.brun.io/eclipse/Solutions-to-build-graphical-modeler/
tt0120737,"You, The Outer Banks, Love is Blind: After the Altar, the Lord of the Rings trilogy and everything else coming to Netflix next month.",Every movie and show coming to Netflix in February,"Even with Netflixs recommendation algorithm serving you new movies, new TV shows, and original programming tailored to your viewing habits, the streaming services fire hose of content makes whats com… [+12348 chars]",https://www.polygon.com/entertainment/2023/2/1/23578014/new-netflix-movies-tv-shows-watch-february-2023
tt0120737,Netflix has agreed a new deal to show Peter Jackson's award-winning fantasy film series on its platform once more.,The Lord of the Rings returns to Netflix very soon – but it might only be temporary,"The Lord of the Rings movie trilogy is heading back to Netflix – but it might only be a temporary stay.
Revealed in a New on Netflix press release, the world's best streaming service will become hom… [+3643 chars]",https://www.techradar.com/news/the-lord-of-the-rings-returns-to-netflix-very-soon-but-it-might-only-be-temporary
tt0120737,All the new movies and series coming up on Netflix over the next 7 days.,"What’s Coming to Netflix This Week: January 30th to February 5th, 2023","Pictured: Arctic, Lyle, Lyle, Crocodile, and New Amsterdam
Welcome to the second bumper week of new releases on Netflix for the year of 2023. As we enter a new month, we’ll be getting a big batch of… [+4745 chars]",https://www.whats-on-netflix.com/coming-soon/whats-coming-to-netflix-this-week-january-30th-to-february-5th-2023/
tt0120737,"Spend Valentine's Day watching ""La La Land"" or ""The Lord of the Rings"" or the chaotic premiere of ""Perfect Match.""",Everything Coming to Netflix in February 2023,"Love is in the air on Netflix in February, from new romcoms like the Reese Witherspoon-starring “Your Place or Mine” to the return of murderous stalker Joe Goldberg in “You” Season 2 part 1.
Penn Ba… [+3185 chars]",https://www.indiewire.com/2023/01/netflix-whats-coming-february-2023-1234803635/
tt0120737,"The first part of You Season 4 is headlining the Netflix schedule in February 2023. On Thursday, February 9, the streaming will release five installments in You Season 4. Based on Caroline Kepnes’s novel series, You centers around Joe Goldberg, a toxic and de…",Netflix February 2023 Schedule: New TV & Movie Release Dates,"The first part of You Season 4 is headlining the Netflix schedule in February 2023. 
On Thursday, February 9, the streaming will release five installments in You Season 4. Based on Caroline Kepness … [+3780 chars]",https://www.comingsoon.net/?p=1263113
tt0060196,"GRID Legends is one of the worst VR ports ever, but the game itself is actually worth your time if you can get past the ugly facade.",GRID Legends for Quest is proof that even bad ports can be pretty good games,"GRID Legends is the perfect illustration of a disastrous game launch. When EA and Codemasters announced the game's existence a mere 6 days before its release, most of us in the XR community had a ver… [+7527 chars]",https://www.androidcentral.com/gaming/virtual-reality/grid-legends-for-quest-is-proof-that-even-bad-ports-can-be-pretty-good-games
tt0060196,"<ol><li>Weekend NHL Rankings: A tipping point for the Avalanche … and maybe the Kraken?  The Athletic
</li><li>NHL Power Rankings: Picking each team's midseason MVP  theScore
</li><li>Weekly Metropolitan Division Snapshot: 01/15/2023 - 01/21/2023  All About…",Weekend NHL Rankings: A tipping point for the Avalanche … and maybe the Kraken? - The Athletic,"OK, now Im worried.
Anyone who has followed this column over the last few months knows the drill when it comes to the Colorado Avalanche. These are the long-term rankings, its about whos positioned … [+13336 chars]",https://theathletic.com/4093155/2023/01/16/nhl-weekend-rankings-avalanche-kraken/
tt0060196,Ana Pineda left academia after teaching a yoga and writing course unleashed her entrepreneurial passion.,"Leaving academia and becoming an online entrepreneur: embracing the good, the bad and the ugly","Anna Pineda runs an education business that helps scientists to be more productive and to improve their writing skills.Credit: Pilar Pineda
Today is the end of the financial quarter, and Im at my ho… [+7773 chars]",https://www.nature.com/articles/d41586-023-00210-1
tt0060196,Commentary: Lisa Marie Presley was one of those famous 1970s kids who felt like a friend.,Lisa Marie Presley: Remembering the Gen X Kid Who Lost Her Dad - CNET,"I never met Lisa Marie Presley. But we were kids together. At least, it feels that way.
I've never heard a single song of hers, and I didn't keep up on her celebrity comings and goings. But still, I… [+5290 chars]",https://www.cnet.com/culture/lisa-marie-presley-remembering-the-gen-x-kid-who-lost-her-dad/
tt0060196,"If you've somehow missed the ChatGPT buzz so far, it's a chatbot equipped with the most advanced example of generative artificial intelligence.",ChatGPT is ready to transform the internet,"Hi, I'm Matt Turner, the editor in chief of business at Insider. Welcome back to Insider Weekly, a roundup of some of our top stories. 
Sign up here to get this newsletter in your inbox each Sunday.… [+4586 chars]",https://www.businessinsider.com/chatgpt-google-salesforce-nepo-baby-zoomtowns-2022-1
tt0060196,"After two difficult pandemic years, CES is back in prime form. Here are CNET's favorite finds from the world's biggest consumer tech show.","Must-See CES Highlights: A Flying Car, a New Gaming Handheld and the Tesla of the Sea - CNET","The future is bright, the future is flying -- and may even fold too. A stunning shape-shifting screen from Samsung and a flying car that may soon actually hit the streets (skies?) were among our favo… [+13289 chars]",https://www.cnet.com/tech/must-see-ces-highlights-a-flying-car-a-new-gaming-handheld-and-the-tesla-of-the-sea/
tt0060196,Sundance film festival: Thoroughbreds and Bad Education director Cory Finley makes an ambitious misstep with a jumbled comedy about controlling aliensIt’s become a depressingly familiar rite of passage for a director of vim and promise to stumble when they am…,Landscape with Invisible Hand review – baffling sci-fi satire misses its mark,Its become a depressingly familiar rite of passage for a director of vim and promise to stumble when they ambitiously decide to adapt a book that should have probably stayed on the shelf. Back in 201… [+4786 chars],https://www.theguardian.com/film/2023/jan/24/landscape-with-invisible-hand-movie-review-sundance
tt0060196,"After years of waiting impatiently in the wings, Leila Farzad has finally landed her first starring role – a ‘callous and cold’ police officer. Here, she talks about Iranian pride, PMT and what she owes I Hate SuzieIn the television show I Hate Suzie, Leila F…","‘To hell with being sweet and affable’: Leila Farzad on acting, pain and speaking her mind","In the television show I Hate Suzie, Leila Farzads character, Naomi, argues the life-changing benefits of PMT. Its the moment of Permanent Mega Truth, she says a brief window every month when a woman… [+12223 chars]",https://www.theguardian.com/tv-and-radio/2023/jan/22/leila-farzad-on-acting-pain-and-speaking-her-mind-better
tt0060196,"Following his announcement to run for reelection in 2024, Trump's social media accounts are opening up.","Trump to get reinstated on Facebook and Instagram soon, Meta confirms",<ul><li>Donald Trump will soon have access to his Facebook and Instagram accounts.</li><li>The two-year suspension on Meta-owned accounts is ending in the coming weeks.</li><li>The reinstatement incl… [+3659 chars],https://www.androidcentral.com/apps-software/meta-announces-donald-trump-facebook-reinstatement
tt0060196,"Abstaining from alcohol is increasingly being destigmatized as more of us consider a booze-free holidayAt first, ankle deep, then wading deeper and deeper, a surge of waves crashed into my thighs as I braced against the tidal tug. My friends were on the beach…",So you decided to stop drinking? I did - and these are my year’s lessons,"At first, ankle deep, then wading deeper and deeper, a surge of waves crashed into my thighs as I braced against the tidal tug. My friends were on the beach, unfurling towels and applying sunscreen. … [+9667 chars]",https://www.theguardian.com/lifeandstyle/2023/jan/02/stop-drinking-alcohol-free-holiday-tips
tt0060196,Boost your visibility and attract more customers with these proven strategies.,10 Crucial Marketing Tips for Online Businesses,"Starting an online business is great for bringing your products or services to a broader audience. However, the competition is fierce, and it can be difficult to stand out in the crowded online marke… [+3995 chars]",https://www.entrepreneur.com/growing-a-business/10-marketing-strategies-for-online-businesses/442446
tt0060196,"Indie picture about a lottery winner who has squandered her winnings is catapulted into Oscar contention thanks to Riseborough’s remarkable, shapeshifting portrayal To Leslie is a sad, sweet country song of a movie, with a steel-guitar twang of love and loss.…",To Leslie review – Andrea Riseborough is great in sad country song of a movie,"To Leslie is a sad, sweet country song of a movie, with a steel-guitar twang of love and loss. Screenwriter Ryan Binaco was inspired by his own mother for this film, conjuring her memory in the spiri… [+4034 chars]",https://www.theguardian.com/film/2023/jan/30/to-leslie-review-andrea-riseborough-is-great-in-sad-country-song-of-a-movie
tt0060196,"Smoldering hot-tubs, kaleidoscopic BMWs, the Bottlenose-Beluga mash-up that is the new USPS truck... CES is the concept launchpad for the good, the bad, and the ugly — immerse yourself in it all with a trip to CES 2023 New Product Announcements on the Core77 …",Designerly Updates from CES in the Core77 Discussion Boards,"Smoldering hot-tubs, kaleidoscopic BMWs, the Bottlenose-Beluga mash-up that is the new USPS truck... CES is the concept launchpad for the good, the bad, and the ugly immerse yourself in it all with a… [+300 chars]",https://www.core77.com/posts/117984/Designerly-Updates-from-CES-in-the-Core77-Discussion-Boards
tt0060196,I worked in law enforcement for decades. The culture is what’s rotten.,No Such Thing as a Bad Apple,"Some 25 years ago, I remember sitting on the Shooting Review Board for the King County Sheriff’s Office, a large metropolitan police department serving the Seattle region. I recall listening to an in… [+6623 chars]",https://www.theatlantic.com/ideas/archive/2023/01/police-brutality-shootings-derek-chauvin/672873/?utm_source=feed
tt0060196,Tennessee opened the season ranked fifth and it was Final Four or bust. Then it all unraveled. And history and expectations might be harder to overcome than injuries and the nation's toughest schedule.,"The Lady Vols' long, slow climb back to greatness and the struggle to uphold a legacy","KNOXVILLE, Tenn. -- Nearly three dozen banners hang from the rafters at Thompson-Boling Arena, the majority dedicated to the Tennessee women's basketball program -- a constant reminder of the history… [+16818 chars]",https://www.espn.com/womens-college-basketball/story/_/id/35525679/tennessee-lady-vols-basketball-pat-summitt-legacy
tt0060196,"It’s safe to say that us developers enjoy programming day in and day out. We also really like making money and being able to feed ourselves and our families. But, we may not want to necessarily work in an office...
The post Python Freelancing: The Good, the B…","Python Freelancing: The Good, the Bad, and the Ugly","It’s safe to say that us developers enjoy programming day in and day out. We also really like making money and being able to feed ourselves and our families. But, we may not want to necessarily work … [+4808 chars]",https://blog.teamtreehouse.com/python-freelancing-good-bad-ugly
tt0060196,"More young workers are posting honest, raw vlogs discussing unemployment. Some are finding new jobs and building a new source of income.",Laid-off workers are posting on TikTok to regain a sense of control,"On a Thursday in August last year, Hayley Bhereur walked out of her office, got into her car, and began sobbing.
The 26-year-old marketer had just been laid off from her job at a nutrition startup i… [+5092 chars]",https://www.businessinsider.com/laid-off-workers-posting-tiktok-videos-regain-control-career-2023-1
tt0060196,"It’s two years since the arrest and imprisonment of Russian opposition leader Alexei Navalny. Here his deputy talks about continuing his fearless anti-corruption work – and why she won’t give up hope of his releaseTwo years ago this week, the leader of the Ru…",‘We do our work because we are angry’: Navalny’s colleague Maria Pevchikh on taking on Putin,"Two years ago this week, the leader of the Russian opposition, Alexei Navalny, flew into Moscow knowing that he faced certain arrest and imprisonment. It was an extraordinary act of courage and leade… [+18784 chars]",https://www.theguardian.com/world/2023/jan/22/navalny-deputy-maria-pevchikh-putin-opposition-corruption-foundation
tt0060196,"When Queen Elizabeth II died last year, she went from “is” to “was” in a split second on Wikipedia. This is the online encyclopedia that teachers have told students countless […]
The post Wikipedia: the good, the bad and the ugly appeared first on Poynter.","Wikipedia: the good, the bad and the ugly","When Queen Elizabeth II died last year, she went from is to was in a split second on Wikipedia.
This is the online encyclopedia that teachers have told students countless times to refrain from using… [+5374 chars]",https://www.poynter.org/tfcn/2023/wikipedia-the-good-the-bad-and-the-ugly/
tt0060196,"Nature shows like David Attenborough's Planet Earth and Nature on PBS are fantastic and eye-opening, helping people to see and appreciate the beauty all around them. But shows like this tend to focus on the most popular and beautiful animals and landscapes. T…","Ryan Reynolds To Narrate Nature Series About Stupid, Ugly, And Overlooked Animals","Nature shows like David Attenborough's Planet Earth and Nature on PBS are fantastic and eye-opening, helping people to see and appreciate the beauty all around them. But shows like this tend to focus… [+1787 chars]",https://www.gamespot.com/articles/ryan-reynolds-to-narrate-nature-series-about-stupid-ugly-and-overlooked-animals/1100-6510580/
tt0060196,"Do you remember the avocado toast guy? I read Johann Hari’s Stolen Focus recently (you should read it, it’s great), and I learned that someone1 has come up with a name for this sort of modern reinterpretation of “let them eat cake”: cruel optimism.
Cruel opti…",Cruel optimism and lazy pessimism,"Do you remember the avocado toast guy? I read Johann Hari’s Stolen Focus recently (you should read it, it’s great), and I learned that someone1 has come up with a name for this sort of modern reinter… [+5141 chars]",https://tegowerk.eu/posts/cruel-optimism/
tt0060196,"Filed under:
 Read This,Tesla,Green Automakers,Green Culture,Safety,Autonomous Vehicles,Electric
 Continue reading NYT takes a deep dive into the character of Elon Musk
NYT takes a deep dive into the character of Elon Musk originally appeared on Autoblog on T…",NYT takes a deep dive into the character of Elon Musk,"Raise your hand if youre sick of reading about Elon Musk. The rest of you, turn to a recent edition of The New York Times Magazine, prepare a grande latte maybe two and settle down to absorb more tha… [+2992 chars]",https://www.autoblog.com/2023/01/17/nyt-takes-a-deep-dive-into-the-character-of-elon-musk/
tt0060196,"Apple's iPad has been a huge success, but that doesn't mean that there weren't failures in its history. Here are the worst iPads Apple has ever released.",The 5 worst iPads of all time,"In 2010, Apple launched the first iPad, and it basically changed the tablet industry forever. Since then, the iPad product lineup has split up into four different models, and there have been a total … [+7547 chars]",https://www.digitaltrends.com/mobile/5-worst-ipads-all-time-apple/
tt0060196,America still needs accountability at every level.,The January 6 Attack Is Not Over,"This is an edition of The Atlantic Daily, a newsletter that guides you through the biggest stories of the day, helps you discover new ideas, and recommends the best in culture. Sign up for it here.On… [+10708 chars]",https://www.theatlantic.com/newsletters/archive/2023/01/the-january-6-attack-is-not-over/672671/?utm_source=feed
tt0060196,Donald Trump has been allowed by Meta to start posting again on Facebook and Instagram as he eyes a return to the White House via t he 2024 election.,Trump allowed to return to Facebook and Instagram,"Meta is ending its suspension of Donald Trump on Facebook and Instagram, allowing the former president to start posting again as he eyes a return to the White House via the 2024 election.
Trump was … [+3229 chars]",https://www.digitaltrends.com/social-media/trump-allowed-to-return-to-facebook-and-instagram/
tt0060196,"Tesla reported its Q4 results and beat profit estimates, but there were major negatives. Click here to read more on TSLA stock and my recommendation.","Tesla's Q4: The Good, The Bad, And The Ugly","Justin Sullivan/Getty Images News
Article Thesis
 Tesla, Inc. (NASDAQ:TSLA) reported its fourth-quarter earnings results that beat estimates on both lines, which is good for shareholders, of course… [+10170 chars]",https://seekingalpha.com/article/4572450-teslas-q4-the-good-the-bad-and-the-ugly
tt0060196,"What's old is new again, and in this case, it's the formative space horror game getting a new, extremely good looking lease on life. Welcome back.","'Dead Space' Is Back, And 'Dead Space' Still Kicks Ass","Look, The Callisto Protocol was well-meaning. Under the right circumstances, such as late in the evening with a beer, it was even good. But The Callisto Protocol tried really hard to be a modern spin… [+15202 chars]",https://www.vice.com/en/article/akebep/dead-space-review
tt0060196,"<ol><li>Eagles-Giants Divisional Round: The good, the bad, and the ugly  Bleeding Green Nation
</li><li>Eagles blow out Giants, remind everyone how dominant they have been all season  Yahoo Sports
</li><li>Why the Giants Will Beat the Eagles, Why they Won't…","Eagles-Giants Divisional Round: The good, the bad, and the ugly - Bleeding Green Nation","The New York Giants had won six-straight games against the No. 1 seed in the NFC playoffs. Its a streak that obviously took years to build, aided by the fact that the Giants had only been in the play… [+8549 chars]",https://www.bleedinggreennation.com/2023/1/22/23566117/eagles-giants-divisional-round-nfl-playoffs-2023-good-bad-ugly-analysis-recap-results-philadelphia
tt0060196,"The bullish market era ended with a splash, and a bearish market took its place. Together with a bearish market mindset. The profits people meant to use for investing in startups disappeared, or lost its value.
For entrepreneurs – it is winter time. 
So what …",Can Startups In A Bearish Market Still Raise Funds?,"The good news is weve seen those kinds of crises in 2008. Before that, in 2000, in 1984, and a flash of it in 2020 (Covid19), and survived.
The bad news is it is painful. It was painful back then an… [+4062 chars]",https://www.forbes.com/sites/urilevine/2023/01/11/can-startups-in-a-bearish-market-still-raise-funds/
tt0060196,"America loves its toys to death, at least if movies are any indication. Since the 1987 introduction of the murderous doll Chucky, killer toys have been a staple of the cineplex. Despite the modest returns of the Child’s Play series, Chucky continued to rampag…",Still friends to the end: the evolution and endless appeal of killer doll movies,"America loves its toys to death, at least if movies are any indication. Since the 1987 introduction of the murderous doll Chucky, killer toys have been a staple of the cineplex. Despite the modest re… [+7335 chars]",https://www.avclub.com/friends-to-the-end-the-golden-age-of-killer-doll-movie-1849930065
tt0060196,"Ex-president to be allowed back ‘in coming weeks … with new guardrails in place’ after ban that followed January 6 attackIn a highly anticipated decision, Meta has said it will allow Donald Trump back on Facebook and Instagram following a two-year ban from th…","Trump’s Facebook and Instagram ban to be lifted, Meta announces","In a highly anticipated decision, Meta has said it will allow Donald Trump back on Facebook and Instagram following a two-year ban from the platforms over his online behavior during the 6 January ins… [+5668 chars]",https://www.theguardian.com/us-news/2023/jan/25/trump-facebook-ban-lifted-unbanned-instagram-meta-pages-latest
tt0060196,"There are some movies whose legacy you can't speak on without also mentioning the composers that gave them their signature sound. John Williams is just as vital to ""E.T. the Extra-Terrestrial"" as Steven Spielberg is. What would ""The Good, the Bad, and the Ugl…",Adding Bill Conti's Music Saved The Ending Of Sylvester Stallone's Rocky,"There are some movies whose legacy you can't speak on without also mentioning the composers that gave them their signature sound. John Williams is just as vital to ""E.T. the Extra-Terrestrial"" as Ste… [+1273 chars]",https://www.slashfilm.com/1184500/adding-bill-contis-music-saved-the-ending-of-sylvester-stallones-rocky/
tt0060196,"Parenting advice on “smelly boys,” distant teens, and unreasonable dads.",Our Daughter’s Feelings About Boys Are Starting to Seem Like a Problem,"Care and Feeding is Slates parenting advice column. Have a question for Care and Feeding? Submit it here.
Dear Care and Feeding, 
My 3-year-old daughter started a pre-school program last year. A fe… [+13758 chars]",https://slate.com/human-interest/2023/01/anti-boy-hate-care-and-feeding.html
tt0060196,"The tone of Clint Eastwood's 2006 war film ""Flags of Our Fathers"" might be surprising. ""Flags of Our Fathers"" is a film extrapolated from the celebrated 1945 Joe Rosenthal photograph titled ""Raising the Flag on Iwo Jima,"" taken at the eponymous battle, and fe…",The Idea That Guided Clint Eastwood Through Filming Flags Of Our Fathers,"Clint Eastwood's relationship with war has, throughout his decades-long career, remained somewhat ambiguous. As an actor, he starred in cynical war films like ""Kelly's Heroes,"" and even whimsical war… [+1421 chars]",https://www.slashfilm.com/1174350/the-idea-that-guided-clint-eastwood-through-filming-flags-of-our-fathers/
