tt0111161,"Frank Darabont's beloved 1994 film made a lot of changes to Stephen King's novella, ""Rita Hayworth and the Shawshank Redemption,"" such as cutting out the ""Rita Hayworth"" part of the title and deciding to not mention the exact details of Red's imprisonment. (I…",Why Morgan Freeman Only Read The First Page Of The Shawshank Redemption Novella,"Although Morgan Freeman doesn't look anything like his novella counterpart, you'll have a hard time finding anyone who doesn't think he did a good job here. As has been widely acknowledged by this po… [+1376 chars]",https://www.slashfilm.com/1163266/why-morgan-freeman-only-read-the-first-page-of-the-shawshank-redemption-novella/
tt0111161,"I'm willing to go to the mattresses to argue that Frank Darabont's ""The Shawshank Redemption"" is a perfect movie. Its origins as a Stephen King novella means it is naturally rich in character development, and the characters are flawed yet sympathetic and lika…",Tim Robbins Thinks This Is Why So Many People Resonated With The Shawshank Redemption,"When Andy Dufresne is wrongfully convicted of killing his wife, he's sentenced to life in prison at the Shawshank prison. When Red Redding first lays eyes on the ""tall drink of water"" newcomer, he do… [+1289 chars]",https://www.slashfilm.com/1163269/tim-robbins-thinks-this-is-why-so-many-people-resonated-with-the-shawshank-redemption/
tt0111161,"""The Shawshank Redemption"" isn't just known for turning Morgan Freeman narration into a meme. If you didn't grow up in the age when Frank Darabont's inspirational prison drama was replayed endlessly on TV, you might not be aware of just how beloved his 1994 e…",How John Frankenheimer 'Directly' Inspired Frank Darabont's Work On The Shawshank Redemption,"Asked by Deadline about the history of prison films, Darabont revealed that, in his opinion ""at the top of the list"" of great prison films was Frankenheimer's ""Birdman of Alcatraz"": ""Oh my gosh, he w… [+1395 chars]",https://www.slashfilm.com/1180328/how-john-frankenheimer-directly-inspired-frank-darabonts-work-on-the-shawshank-redemption/
tt0111161,"""The Shawshank Redemption"" was released in theaters nearly 29 years ago, and it's still the highest-rated film on IMDb. It's the definitive prison movie, one that's been parodied and referenced to death in pop culture, and it's probably going to be sticking a…",Director Frank Darabont Doesn't Think He Could Get The Shawshank Redemption Made Today,"When asked whether the movie landscape was completely hopeless, Darabont did at least have some movies he enjoyed recently that he could point to. ""I do see some personal soul-making still happening.… [+1410 chars]",https://www.slashfilm.com/1165711/director-frank-darabont-doesnt-think-he-could-get-the-shawshank-redemption-made-today/
tt0111161,"While ""The Shawshank Redemption"" is a perfect example of a great American movie, its legacy as a weekend dad film cannot be understated. There have been more than a few moments in my life where I have walked into my family's living room, only to find my dad a…",Director Frank Darabont Gives Ted Turner Partial Credit For The Shawshank Redemption's Success,"""Turner started airing 'Shawshank' on TV like every five minutes for years,"" Darabont said. ""There was this endless opportunity for people to catch up with it on a Turner network, and so I bless Ted … [+1241 chars]",https://www.slashfilm.com/1163458/director-frank-darabont-gives-ted-turner-partial-credit-for-the-shawshank-redemptions-success/
tt0111161,"Romance is in the air as February is upon us. From love stories like Eat Pray Love and Sing Street to Peter Jackson’s epic Lord Of The Rings trilogy, Netflix has a nice variety of rom-coms, horror films, classics, and more to keep you cozied up on the couch a…",The 15 best films coming to Netflix this February,"Arguably the best adaptation of a Stephen King horror novel (which disqualifies The Shawshank Redemption and The Green Mile), It is a fun, creepy, and ultimately touching story of how young people ma… [+796 chars]",https://www.avclub.com/best-new-netflix-films-february-2023-1850045231
tt0111161,"Frank Darabont has plenty to be proud of. The writer-director behind the likes of ""The Shawshank Redemption"" and ""The Green Mile,"" and showrunner for ""The Walking Dead"" has earned legions of dedicated fans over his multi-decade career. He's long been consider…",One Moment From 2007's The Mist Genuinely Scared Stephen King,"Frank Darabont has plenty to be proud of. The writer-director behind the likes of ""The Shawshank Redemption"" and ""The Green Mile,"" and showrunner for ""The Walking Dead"" has earned legions of dedicate… [+1540 chars]",https://www.slashfilm.com/1176353/one-moment-from-2007s-the-mist-genuinely-scared-stephen-king/
tt0111161,"Not so long ago, Netflix had the reputation for saving movies and TV shows. As the biggest streamer, Netflix was able to give closure to fans of ""Arrested Development,"" ""Lucifer,"" ""Gilmore Girls,"" ""Designated Survivor,"" and even ""Star Wars: The Clone Wars"" wh…","Netflix Scraps Two Completed Films, Continuing Awful Industry Trend","Both of the movies that Netflix is dumping are genre pictures, which you'd think would be their bread and butter since it's the streaming service that owes much of its industry power to ""Stranger Thi… [+1571 chars]",https://www.slashfilm.com/1181112/netflix-scraps-two-completed-films-continuing-awful-industry-trend/
tt0111161,"Ukraine needs any weapon its troops can learn to use, including tanks, to hold the line on the international order and the world’s safety.","To Defend Civilization, Defeat Russia","This is an edition of  The Atlantic Daily, a newsletter that guides you through the biggest stories of the day, helps you discover new ideas, and recommends the best in culture. Sign up for it here.S… [+10052 chars]",https://www.theatlantic.com/newsletters/archive/2023/01/ukraine-russia-weapons-nato-germany/672817/?utm_source=feed
tt0111161,"Every new Taylor Sheridan drama promises to be more star-studded than the last. The screenwriter and creator-showrunner of the ""Yellowstone"" universe (and a handful of other Paramount+ shows) has previously enticed stars like Harrison Ford, Helen Mirren, Sylv…",Taylor Sheridan's Lioness Adds Morgan Freeman,"""Lioness"" is apparently based on a real-life CIA program. It's unclear at this point how much of the series will be inspired by the truth and how much will be fictionalized, but there's obviously nev… [+1185 chars]",https://www.slashfilm.com/1167323/taylor-sheridans-lioness-adds-morgan-freeman/
tt0111161,"В первой двадцатке нет «Гражданина Кейна» — зато есть «Звёздные войны», «Тёмный рыцарь» и «Крёстный отец».",Журнал Empire назвал 100 величайших фильмов всех времён,"Empire -100 . Empire.
 100-81
 «», «» « »
100. « » (Reservoir Dogs, 1992)
99. « » (Groundhog Day, 1993)
98. « 2» (Paddington 2, 2017)
97. «» (Amelie, 2001)
96. « » (Brokeback Mountain, 2005)
… [+3394 chars]",https://lifehacker.ru/empire-top-100-filmov-vsex-vremen/
tt0111161,"Ask most hardcore movie fans their top ten favorite movies of all time, and a least a handful of them are going to include The Shawshank Redemption. Based on a novella by Stephen King, much like Stand By Me, this movie tells a tale of life, friendship, and th…",Fans Step Up to Defend the Plot Hole Pointed Out by Viewers of THE SHAWSHANK REDEMPTION,"Ask most hardcore movie fans their top ten favorite movies of all time, and a least a handful of them are going to include The Shawshank Redemption. Based on a novella by Stephen King, much like Stan… [+2374 chars]",https://geektyrant.com/news/fans-step-up-to-defend-the-plot-hole-pointed-out-by-viewers-of-the-shawshank-redemption
tt0111161,"The people have spoken, and these are the films they've chosen. 
Any time you have a list of what's considered the best movies of all time, someone is going to have a problem with it. They'll be mad about what's left off, what got on, and the order. But that…",Film Fans and Critics Picked the 100 Best Movies Of All Time,"The people have spoken, and these are the films they've chosen.  
 Any time you have a list of what's considered the best movies of all time, someone is going to have a problem with it. They'll be m… [+3452 chars]",https://nofilmschool.com/empire-online-lists-their-100-best-movies-all-time
tt0111161,"Lamb of God, Megadeth, Volbeat, GWAR, and more will also play the three-day fest at the Ohio State Reformatory.
2023 Inkcarceration Festival Lineup: Limp Bizkit, Pantera, Slipknot, and More
Anne Erickson","2023 Inkcarceration Festival Lineup: Limp Bizkit, Pantera, Slipknot, and More","The Inkcarceration Music &amp; Tattoo Festival has revealed its 2023 lineup, featuring headliners Limp Bizkit, Pantera and Slipknot.
The festival is set for July 14th-16th at the Ohio State Reformat… [+1331 chars]",https://consequence.net/2023/02/2023-inkcarceration-festival-limp-bizkit-pantera-slipknot/
tt0111161,"AMC wants the $200 million profits lawsuit from The Walking Dead creator Robert Kirkman, Gale Anne Hurd and fellow executive producers to be D.O.A. “Having lost resoundingly in state court on different theories, Plaintiffs are at it again, now asking this Cou…","AMC Wants ‘Walking Dead’ Creator Robert Kirkman, Fellow EPs $200M Profits Suit Tossed","AMC wants the $200 million profits lawsuit fromThe Walking Deadcreator Robert Kirkman, Gale Anne Hurd and fellow executive producers to be D.O.A.
“Having lost resoundingly in state court on differen… [+3590 chars]",https://deadline.com/2023/01/walking-dead-profits-suit-robert-kirkman-gale-anne-hurd-amc-dismissal-motion-1235225199/
tt0111161,"Im Gefängnis-Drama „Die Verurteilten“ plant ein Insasse seinen Ausbruch. Ob der Film auf einer wahren Geschichte beruht, wollen wir hier erörtern.",Die wahre Geschichte zu „Die Verurteilten“: Hintergründe zum Knastdrama,"Im Gefängnis-Drama Die Verurteilten plant ein Insasse seinen Ausbruch. Ob der Film auf einer wahren Geschichte beruht, wollen wir hier erörtern.
1947 landet der Banker Andy Dufrese (Tim Robbins) weg… [+3345 chars]",https://www.kino.de/artikel/die-wahre-geschichte-zu-die-verurteilten--pph9c2pp7v
tt0111161,"Tiny towels and stale Wonder Bread were a bother, but for the former FTX chief, jail time in the Bahamas was unbearable because he was offline. Under house arrest in his parents’ California home, he’s been pleading his case on a new Substack and playing his f…",Bankman-Fried Behind Bars: How Being Unplugged From The Internet Untethered The Former Crypto Billionaire,"Sam Bankman-Fried, co-founder of FTX, arrives at court in New York, US, on Tuesday, Jan. 3, 2023. 
Stephanie Keith/Bloomberg 
For 31 days starting November 11, Sam Bankman-Fried, former billionaire… [+11601 chars]",https://www.forbes.com/sites/stevenehrlich/2023/01/26/bankman-fried-behind-bars-how-being-unplugged-from-the-internet-untethered-the-former-crypto-billionaire/
tt0111161,"The horror genre is no stranger to films set at a summer camp where people inevitably end up dying in a myriad of horrible ways. She Came From The Woods is the latest example of this trope, and one that seems to be doubling down on it given it takes place in …",She Came From The Woods Trailer Confirms That Summer Camp Is Still a Murderous Affair,"The horror genre is no stranger to films set at a summer camp where people inevitably end up dying in a myriad of horrible ways. She Came From The Woods is the latest example of this trope, and one t… [+1139 chars]",https://www.tor.com/2023/01/23/she-came-from-the-woods-trailer-confirms-that-summer-camp-is-still-a-murderous-affair/
tt0111161,"Drug-smuggling pigeons have persisted over the decades, busted from North America to Europe and Asia. Last week, for the first time in recent memory, one was captured at a correctional facility in B.C.",Pigeon wearing crystal meth 'like a backpack' caught inside B.C. prison yard,"Nearly a century ago, a pigeon breeder approached federal customs officers with a bit of an odd problem.
A pigeon he'd recently sold to a buyer in Mexico had flown back to his home in Texas with two… [+3602 chars]",https://www.cbc.ca/news/canada/british-columbia/pigeon-caught-with-meth-inside-bc-prison-1.6704753
tt0111161,"Steven Spielberg, Cate Blanchett, and everybody else whose Oscar nominations broke records and set milestones.","The 2023 Oscar Nominations, by the Numbers","Another Oscar nomination morning has passed, with Allison Williams and Riz Ahmed confidently guiding us through a very un-quiet Western Front, past The Banshees of Inisherin, to take in Everything Ev… [+4984 chars]",https://www.vanityfair.com/hollywood/2023/01/awards-insider-2023-oscar-nominations-statistics
tt0111161,"Okay, buckle up, Dexter fans. About five months after a Paramount+ executive said they were ""actively working on"" more from the series with regards to either additional seasons or spinoffs, TVLine is reporting that Showtime (which will be merging with the str…",Dexter: New Blood Season 2 Not Happening; Prequel Being Eyed: Report,"Reports are that Showtime will not be moving forward on Dexter: New Blood Season 2 but is considering spinoffs set in the show's universe.
Okay, buckle up, Dexter fans. About five months after a Par… [+2885 chars]",https://bleedingcool.com/tv/dexter-new-blood-season-2-not-happening-prequel-being-eyed-report/
tt0111161,"""The Olympus Mons is thought to be the biggest volcano in the entire solar system...and it's on Mars""",8 Interesting Facts That Most People Don’t Know,"Okay, friends, today we’re going to dazzle your  minds and satisfy your rampant curiosity with 8 incredibly interesting facts that are going to knock your socks off!
Read on to get a whole lot of gr… [+4938 chars]",https://twistedsifter.com/2023/01/8-interesting-facts-that-most-people-dont-know/
tt0111161,"In three recent films, institutional Christianity is the villain. Thinking carefully about these depictions can strengthen our evangelism and apologetics.","Villainous Christianity in ‘The Whale,’ ‘The Wonder,’ and ‘Women Talking’","The Christian villain trope is nothing new in Hollywood. From sociopathic Christian killers (The Night of the Hunter, Se7en) to prudish, sexually repressed fundamentalists (Footloose, Carrie, The Vir… [+12964 chars]",https://www.thegospelcoalition.org/article/villainous-christianity-movies/
tt0111161,"Fresh off his latest film, A Man Called Otto, with a few more roles lined up, Tom Hanks reveals if he ever plans on retiring from acting.",Tom Hanks Reveals If He Will Ever Retire From Acting,"A Man Called Otto star Tom Hanks reveals if he ever plans on retiring from acting. The beloved actor broke through in his mid-20s with the 1984 film Splash, which led to a series of critically acclai… [+2767 chars]",https://screenrant.com/tom-hanks-acting-retirement-response/
tt0111161,"Netflix a été il n’y a pas si longtemps connu pour être le sauveur des films et des séries télévisées : Lucifer, Gilmore Girls, Arrested Development, Designated Survivor, The Cloverfield Paradox, etc. Mais il semblerait que cette époque soit révolue, car selo…",Netflix suit la tendance de l’industrie et abandonne deux films terminés,"Netflix a été il ny a pas si longtemps connu pour être le sauveur des films et des séries télévisées : Lucifer, Gilmore Girls, Arrested Development, Designated Survivor, The Cloverfield Paradox, etc.… [+2169 chars]",https://www.fredzone.org/netflix-suit-la-tendance-de-lindustrie-et-abandonne-deux-films-termines-418179/
tt0111161,"Learn More Where Is The Cast Of The Shawshank Redemption Today? Since its release in 1994, ""The Shawshank Redemption"" has become one of the most celebrated films of all time. Based on a novella by Stephen King, Frank Darabont's adaptation is also widely regar…",Where Is The Cast Of The Shawshank Redemption Today?,"Learn More Where Is The Cast Of The Shawshank Redemption Today? Since its release in 1994, ""The Shawshank Redemption"" has become one of the most celebrated films of all time. Based on a novella by St… [+341 chars]",https://biztoc.com/x/3421fdae59ecd125
tt0111161,People Share Movies They Can Watch Over And Over Again  (19 PICS),People Share Movies They Can Watch Over And Over Again (19 PICS),"""The mummy from 1999""
""Good will hunting""
""Any classic Miyazaki movie, but especially Spirited Away""
""Terminator 2: Judgement Day. Its always better than I remember on rewatch.""
""The Blues Brothe… [+654 chars]",https://izismile.com/2023/01/10/people_share_movies_they_can_watch_over_and_over_again_19_pics.html
tt0111161,"Inkcarceration Music & Tattoo Festival have announced that Slipknot, Pantera and Limp Bizkit will headline their 2023 event","Slipknot, Pantera, Limp Bizkit to headline Inkcarceration Music & Tattoo Festival 2023","Inkcarceration Music &amp; Tattoo Festival have announced that Slipknot, Pantera and Limp Bizkit will headline their 2023 event.
The festival is based in Mansfield, Ohio, at the historic grounds of … [+1744 chars]",https://www.loudersound.com/news/slipknot-pantera-limp-bizkit-to-headline-inkcarceration-music-and-tattoo-festival-2023
tt0111161,The Inheritance and House/Wife are looking for new homes,Netflix reportedly scraps two new movies that are already complete,"Netflix has scrapped two completed movies before they were released on the platform, according to The Hollywood Reporter
 (opens in new tab). 
One of these movies is The Inheritance, directed by Al… [+1516 chars]",https://www.gamesradar.com/netflix-scraps-two-completed-movies/
tt0111161,Marathon Movies: The Best Long Films Ranked  (25 PICS),Marathon Movies: The Best Long Films Ranked (25 PICS),"#25:Casino
Running Time: 3 hr. 2 min.
#24: The Departed
Running Time: 2 hr. 32 min.
#23: Scarface
Running Time: 2 hr. 50 min.
#22: Pirates of the Caribbean: The Curse of the Black Pearl
Runnin… [+1177 chars]",https://izismile.com/2023/01/19/marathon_movies_the_best_long_films_ranked_25_pics.html
tt0111161,"When Josh Duggar was sentenced to 151 months in federal prison, critics delighted in predicting that he wouldn’t fare well …
Josh Duggar Is NOT Popular With His Fellow Inmates, Prisoner Reveals was originally published on The Hollywood Gossip .","Josh Duggar Is NOT Popular With His Fellow Inmates, Prisoner Reveals","When Josh Duggar was sentenced to 151 months in federal prison, critics delighted in predicting that he wouldn’t fare well behind bars.
However, early reports from the inside indicated that, to the … [+3208 chars]",http://www.thehollywoodgossip.com/2023/01/josh-duggar-is-not-popular-with-his-fellow-inmates-prisoner-reveals/
tt0111161,"Sam Bankman-Fried reportedly said that he thought his time in prison in the Bahamas would be like the 1994 classic film ""The Shawshank Redemption."" ""I thought that it was going to be like The Shawshank Redemption,"" the disgraced FTX founder and CEO told Forbe…",FTX crypto founder Sam Bankman-Fried thought jail would be 'like The Shawshank Redemption': report,"Sam Bankman-Fried reportedly said that he thought his time in prison in the Bahamas would be like the 1994 classic film ""The Shawshank Redemption.""""I thought that it was going to be like The Shawshan… [+325 chars]",https://biztoc.com/x/558e85d809c7dc61
tt0111161,"Sam Bankman-Fried reportedly said that he thought his time in prison in the Bahamas would be like the 1994 classic film ""The Shawshank Redemption."" ""I thought that it was going to be like The Shawshank Redemption,"" the disgraced FTX founder and CEO told Forbe…",FTX crypto founder Sam Bankman-Fried thought jail would be 'like The Shawshank Redemption': report,"Sam Bankman-Fried reportedly said that he thought his time in prison in the Bahamas would be like the 1994 classic film ""The Shawshank Redemption.""""I thought that it was going to be like The Shawshan… [+325 chars]",https://biztoc.com/x/e07156a1bf602d17
tt0111161,"Learn where to watch Forrest Gump, the box-office sensation featuring a standout Tom Hanks performance as an intellectually challenged man",Where To Watch Forrest Gump,"Find out where to watch Forrest Gump, the epic drama about an intellectually challenged man that would go on to win six Academy Awards.
1994 was one of the most memorable years for movie releases, w… [+4120 chars]",https://screenrant.com/where-to-watch-forrest-gump/
tt0111161,"Sam Bankman-Fried reportedly said that he thought his time in prison in the Bahamas would be like the 1994 classic film ""The Shawshank Redemption."" ""I thought that it was going to be like The Shawshank Redemption,"" the disgraced FTX founder and CEO told Forbe…",FTX crypto founder Sam Bankman-Fried thought jail would be 'like The Shawshank Redemption': report,"Sam Bankman-Fried reportedly said that he thought his time in prison in the Bahamas would be like the 1994 classic film ""The Shawshank Redemption.""""I thought that it was going to be like The Shawshan… [+313 chars]",https://biztoc.com/x/0d521be6361f0780
tt0111161,"Celebrities having birthdays during the week of Jan. 22-28 include actor Alan Alda, dancer Mikhail Baryshnikov and rapper J",Celebrity birthdays for the week of Jan. 22-28,"Sign up to our Evening Headlines email for your daily guide to the latest news
Sign up to our free US Evening Headlines email
Celebrity birthdays for the week of Jan. 22-28:
Jan. 22: Actor Piper L… [+6745 chars]",https://www.independent.co.uk/news/world/americas/ap-diane-lane-guy-fieri-balthazar-getty-ed-helms-b2263747.html
tt0111161,"From animated treasures like Spirited Away to Parasite, the first non-English film to win Best Picture, these are Letterboxd's best-rated movies.",15 Highest Scored Movies On Letterboxd,"Letterboxd is a community made up mostly of film geeks and cinephiles from all over the globe. The site ranks movies with 5 stars, with each half-star making it a 10-point scale system. The average o… [+11944 chars]",https://screenrant.com/letterboxd-highest-scoring-films/
tt0111161,"Paramount+ ha anunciado hoy que el ganador del Oscar Morgan Freeman se unirá al reparto de la próxima serie original LIONESS junto a la protagonista y productora ejecutiva Zoe Saldaña, la ganadora del Oscar y productora ejecutiva Nicole Kidman y Laysla De Oli…",Morgan Freeman se une al reparto de estrellas de la serie Paramount+ “Lioness”,"Paramount+ ha anunciado hoy que el ganador del Oscar Morgan Freeman se unirá al reparto de la próxima serie original LIONESS junto a la protagonista y productora ejecutiva Zoe Saldaña, la ganadora de… [+4593 chars]",https://isopixel.net/2023/01/13/morgan-freeman-se-une-al-reparto-de-estrellas-de-la-serie-paramount-lioness/
tt0111161,"John Wick 4 features many new characters, including friends and foes played by action icons like Donnie Yen, Hiroyuki Sanada, and Scott Adkins.",Every Confirmed New Character In John Wick 4 (& What We Know),"2023 will see the latest installment in one of modern film’s most compelling action sagas in John Wick: Chapter 4, with several new characters set to be introduced. John Wick: Chapter 4 picks up imme… [+6277 chars]",https://screenrant.com/john-wick-4-every-new-character-confirmed/
tt0111161,"Sam Boyer wrote the original screenplay “Ojek” which won a 2022 Nicholl Fellowship in Screenwriting. Recently, I had the opportunity to chat with Sam about his creative background, his award-winning…",Interview (Part 1): Sam Boyer,"My interview with the 2022 Nicholl Fellowships in Screenwriting winner.Sam Boyer wrote the original screenplay Ojek which won a 2022 Nicholl Fellowship in Screenwriting. Recently, I had the opportuni… [+7080 chars]",https://gointothestory.blcklst.com/interview-part-1-sam-boyer-a34957df4821
tt0111161,"Get busy living, or get busy drying. Former billionaire Sam Bankman-Fried was reduced to using a hose and cold water to take a shower while languishing in a Bahamian prison that the indicted crypto mogul said was “like ‘The Shawshank Redemption,'” according t…",Sam Bankman-Fried thought jail would be ‘like The Shawshank Redemption’,"Get busy living, or get busy drying.Former billionaire Sam Bankman-Fried was reduced to using a hose and cold water to take a shower while languishing in a Bahamian prison that the indicted crypto mo… [+320 chars]",https://biztoc.com/x/376e8b42dc5f5536
tt0111161,"The remake of the classic Stephen King horror film from Kurt Wimmer finds a home at Shudder and RLJE Films which releases in March.
The post Children of the Corn: Stephen King remake has been acquired by Shudder appeared first on JoBlo.",Children of the Corn: Stephen King remake has been acquired by Shudder,"The remake of the classic Stephen King horror film from Kurt Wimmer finds a home at Shudder and RLJE Films which releases in March.
While streaming services war with each other, one that’s hanging o… [+2232 chars]",https://www.joblo.com/children-of-the-corn-remake-shudder/
tt0111161,Another strong year for the annual festival. Continue reading…,Inkcarceration Music + Tattoo Festival Unveils Full 2023 Lineup,"The 2023 lineup for the Inkcarceration Music and Tattoo Festival at the Ohio State Reformatory in Mansfield, Ohio has officially been unveiled with Limp Bizkit, Pantera and Slipknot tabbed as the hea… [+2757 chars]",https://loudwire.com/inkcarceration-music-tattoo-festival-2023-lineup/
